{
  "schema_version": "1.0.0",
  "methodology_version": "1.0.0",
  "severity": 3,
  "structural_type": "budgetary",
  "assessments": [
    {
      "group": "estudantes",
      "defending_vote": null,
      "impact_direction": "positive",
      "rationale": "O substitutivo ao PLP 230/2025 assegura internet de qualidade para todas as escolas públicas de educação básica, especialmente fora da zona urbana. Como a matéria foi votada em pacote composto (regras de contingenciamento do FUST e benefício fiscal para prestadoras), sem destaque isolador, a faceta textual é positiva para estudantes, mas a atribuição de defending_vote no evento de votação global permanece null.",
      "confidence": 0.97,
      "sources": [
        "https://dadosabertos.camara.leg.br/api/v2/proposicoes/2580259",
        "https://www.camara.leg.br/proposicoesWeb/prop_mostrarintegra?codteor=3170169",
        "https://dadosabertos.camara.leg.br/api/v2/votacoes/2580259-24/votos",
        "https://escriba.camara.leg.br/escriba-servicosweb/html/82876"
      ],
      "reviewed": [
        {
          "reviewer_type": "curadoria_interna",
          "reviewed_at": "2026-08-30T06:54:00-03:00",
          "reviewer_id": "editorial-review-deep-2026-08-30"
        },
        {
          "reviewer_type": "painel_externo",
          "reviewed_at": "2026-08-30T06:54:00-03:00",
          "reviewer_id": "gate-lourenco-2026-08-30"
        }
      ]
    }
  ],
  "review_status": "approved"
}
